{
  "schema_version": 1,
  "event_id": "room_108_entrails_bathtub",
  "source_scene_id": "room_108_bathroom",
  "source_path": "res://resource/images/room_108_bathroom.png",
  "source_sha256": "668ddd1c70b50b78507bf3ceec9d2a4b25c50142df9c37e55399672d73b1c999",
  "canvas": {
    "width": 1448,
    "height": 1086
  },
  "states": {
    "visible": {
      "full_scene_variant": {
        "path": "res://resource/images/anomalies/room_108_entrails_bathtub/room_108_bathroom/visible.png",
        "sha256": "bc4c864a7b622af96ec1ad751f94a9895973fe33f8e8fbb2d26a1346af029179",
        "width": 1448,
        "height": 1086
      }
    },
    "resolved": {
      "base_only": true
    }
  }
}
