{
  "schema_version": 1,
  "event_id": "vacant_room_blanket_child",
  "source_scene_id": "room_108_bed_window",
  "source_path": "res://resource/images/room_108_bed_window.png",
  "source_sha256": "b96cab3b0ad0a50c97703b4c73c5060d80e6caebbab54cfc3e392cbd5febcfcb",
  "canvas": {
    "width": 1448,
    "height": 1086
  },
  "states": {
    "visible": {
      "full_scene_variant": {
        "path": "res://resource/images/anomalies/vacant_room_blanket_child/room_108_bed_window/visible.webp",
        "sha256": "c22dde8c0e958d619263fa9171c6b53b0ec9d1f8d405568d1c4e5ddc6c398546",
        "width": 2896,
        "height": 2172
      }
    },
    "resolved": {
      "base_only": true
    }
  }
}
