{
  "schema_version": 1,
  "event_id": "front_glass_face",
  "source_scene_id": "front_desk",
  "source_path": "res://resource/images/front_desk.png",
  "source_sha256": "9fc6b06e7f7f9fa0fdf909ef569c7be6e8b36446db87e8202f838192179f9f60",
  "canvas": {
    "width": 1535,
    "height": 1024
  },
  "states": {
    "visible": {
      "full_scene_variant": {
        "path": "res://resource/images/anomalies/front_glass_face/front_desk/visible.webp",
        "sha256": "fae58ab98aeaad894ae5f2129017159e96461927f51308677a5ecbf5328984cb",
        "width": 3070,
        "height": 2048
      }
    },
    "hostile": {
      "full_scene_variant": {
        "path": "res://resource/images/anomalies/front_glass_face/front_desk/hostile.webp",
        "sha256": "6996cd0a7c0f755dc843ced28af9eb4e04bfc22ed1074cad08751430d55186ad",
        "width": 3070,
        "height": 2048
      }
    },
    "resolved": {
      "base_only": true
    }
  }
}
