{
  "schema_version": 1,
  "event_id": "laundry_baby_face_surfaces",
  "source_scene_id": "laundry_room",
  "source_path": "res://resource/images/laundry_room.png",
  "source_sha256": "a8f8d1ee81d1aae0a155a85bf1508935aa0c1be9b95b7b11f6ca19d325209d8f",
  "canvas": {
    "width": 1195,
    "height": 896
  },
  "states": {
    "visible": {
      "full_scene_variant": {
        "path": "res://resource/images/anomalies/laundry_baby_face_surfaces/laundry_room/visible.png",
        "sha256": "87556d597f458849ae7514655fa923ca9a93c1a050266c893cb9f1c3be956bac",
        "width": 1195,
        "height": 896
      }
    },
    "resolved": {
      "base_only": true
    }
  }
}
