{
  "schema_version": 1,
  "event_id": "corridor_blood_puddle",
  "source_scene_id": "corridor",
  "source_path": "res://resource/images/corridor.png",
  "source_sha256": "a715b594a0abbf4502e2751d991f76d5331b44a9c57850cfad8898f0e459d867",
  "canvas": {
    "width": 1536,
    "height": 1024
  },
  "states": {
    "visible": {
      "full_scene_variant": {
        "path": "res://resource/images/anomalies/corridor_blood_puddle/corridor/visible.webp",
        "sha256": "c7dfd001f36d6560279906a6a6d2643b6a07a583fa2c7bf681511827a55babd0",
        "width": 3072,
        "height": 2048
      }
    },
    "resolved": {
      "base_only": true
    }
  }
}
