{
  "schema_version": 1,
  "event_id": "room_105_closet_pig_man",
  "source_scene_id": "room_105_bathroom_entry",
  "source_path": "res://resource/images/room_105_bathroom_entry.png",
  "source_sha256": "f08d002b70d9129c49f50fe2403f7ecccf7a49db44959d2101661cbbe79b66e3",
  "canvas": {
    "width": 1535,
    "height": 1024
  },
  "states": {
    "door_open": {
      "full_scene_variant": {
        "path": "res://resource/images/anomalies/room_105_closet_pig_man/room_105_bathroom_entry/stage_1.webp",
        "sha256": "670ce79eec24bfa352de4c8d7a6b890b50dbabd6994798e196d136dd4a9b805f",
        "width": 3070,
        "height": 2048
      }
    },
    "face": {
      "full_scene_variant": {
        "path": "res://resource/images/anomalies/room_105_closet_pig_man/room_105_bathroom_entry/stage_2.webp",
        "sha256": "c5e0389c435df39083a971138d3f914e8c513991749869eb082b41a8de53aa47",
        "width": 3070,
        "height": 2048
      }
    }
  }
}
