{
  "schema_version": 1,
  "event_id": "room_107_empty_hanging_rope",
  "source_scene_id": "room_107_bed_nightstand",
  "source_path": "res://resource/images/room_107_bed_nightstand.png",
  "source_sha256": "7a4554e7c77990024109641eef99e559018469c440dd34cded42f333a1192926",
  "canvas": {
    "width": 1448,
    "height": 1086
  },
  "states": {
    "visible": {
      "full_scene_variant": {
        "path": "res://resource/images/anomalies/room_107_empty_hanging_rope/room_107_bed_nightstand/visible.webp",
        "sha256": "b80c84d6fa6d99b7c711296aaf3372eb43c38d6090c4c7c0f7be65b146856e11",
        "width": 2896,
        "height": 2172
      }
    },
    "resolved": {
      "base_only": true
    }
  }
}
