{
  "schema_version": 1,
  "event_id": "room_105_grotesque_portrait",
  "source_scene_id": "room_105_bathroom_entry",
  "source_path": "res://resource/images/room_105_bathroom_entry.png",
  "source_sha256": "f08d002b70d9129c49f50fe2403f7ecccf7a49db44959d2101661cbbe79b66e3",
  "canvas": {
    "width": 1535,
    "height": 1024
  },
  "states": {
    "visible": {
      "full_scene_variant": {
        "path": "res://resource/images/anomalies/room_105_grotesque_portrait/room_105_bathroom_entry/visible.png",
        "sha256": "b13bdda6d3c3d483722bdc6063cb65653c5bf04074ffc903bc159287e4172509",
        "width": 1535,
        "height": 1024
      }
    },
    "resolved": {
      "base_only": true
    }
  }
}
