{
  "schema_version": 1,
  "event_id": "stairs_hell_arrow",
  "source_scene_id": "exterior_stairs",
  "source_path": "res://resource/images/exterior_stairs.png",
  "source_sha256": "08c3c7d654468dd1e309f8514518d85bc471ed91ec11f52fb748879949de668f",
  "canvas": {
    "width": 1448,
    "height": 1086
  },
  "states": {
    "visible": {
      "full_scene_variant": {
        "path": "res://resource/images/anomalies/stairs_hell_arrow/exterior_stairs/visible.webp",
        "sha256": "9fb9d1ba3c1ccc4c5a343f81a7c1c19c2d768b90f5b3ab9756d46e598d1f3287",
        "width": 2896,
        "height": 2172
      }
    },
    "resolved": {
      "base_only": true
    }
  }
}
