{
  "schema_version": 1,
  "event_id": "corridor_red_room_light",
  "source_scene_id": "corridor",
  "source_path": "res://resource/images/corridor.png",
  "source_sha256": "a715b594a0abbf4502e2751d991f76d5331b44a9c57850cfad8898f0e459d867",
  "canvas": {
    "width": 1536,
    "height": 1024
  },
  "states": {
    "visible": {
      "full_scene_variant": {
        "path": "res://resource/images/anomalies/corridor_red_room_light/corridor/visible.webp",
        "sha256": "571d758aadc2ddb533868323471cbff029241c317eacb3c778dfd8cc000b0ebd",
        "width": 3072,
        "height": 2048
      }
    },
    "resolved": {
      "base_only": true
    }
  }
}
