{
  "schema_version": 1,
  "event_id": "room_106_horrific_mirror",
  "source_scene_id": "room_106_bathroom",
  "source_path": "res://resource/images/room_106_bathroom.png",
  "source_sha256": "668ddd1c70b50b78507bf3ceec9d2a4b25c50142df9c37e55399672d73b1c999",
  "canvas": {
    "width": 1448,
    "height": 1086
  },
  "states": {
    "visible": {
      "full_scene_variant": {
        "path": "res://resource/images/anomalies/room_106_horrific_mirror/room_106_bathroom/visible.webp",
        "sha256": "401270bc5764a8678ae3b69290c60935a37de7a57d1c80588ee3a7be3a80f9a1",
        "width": 2896,
        "height": 2172
      }
    },
    "resolved": {
      "base_only": true
    }
  }
}
