{
  "schema_version": 1,
  "event_id": "room_108_tv_ghost",
  "source_scene_id": "room_105_bathroom_entry",
  "source_path": "res://resource/images/room_105_bathroom_entry.png",
  "source_sha256": "f08d002b70d9129c49f50fe2403f7ecccf7a49db44959d2101661cbbe79b66e3",
  "canvas": {
    "width": 1535,
    "height": 1024
  },
  "states": {
    "visible": {
      "full_scene_variant": {
        "path": "res://resource/images/anomalies/room_108_tv_ghost/room_105_bathroom_entry/visible.webp",
        "sha256": "16350dd787a2c104b30aef1f55d0a383a0f67051db2d210f5c9ed0e3974a05b1",
        "width": 3070,
        "height": 2048
      }
    },
    "flicker": {
      "full_scene_variant": {
        "path": "res://resource/images/anomalies/room_108_tv_ghost/room_105_bathroom_entry/visible.webp",
        "sha256": "16350dd787a2c104b30aef1f55d0a383a0f67051db2d210f5c9ed0e3974a05b1",
        "width": 3070,
        "height": 2048
      }
    },
    "hostile": {
      "full_scene_variant": {
        "path": "res://resource/images/anomalies/room_108_tv_ghost/room_105_bathroom_entry/hostile.webp",
        "sha256": "984289b7bce022acf45b36bca3a7620c484628320fd429d25eca2b808845a94b",
        "width": 3070,
        "height": 2048
      }
    },
    "resolved": {
      "base_only": true
    }
  }
}
