{
  "schema_version": 1,
  "event_id": "room_107_hanging_girl",
  "source_scene_id": "room_107_bed_nightstand",
  "source_path": "res://resource/images/room_107_bed_nightstand.png",
  "source_sha256": "7a4554e7c77990024109641eef99e559018469c440dd34cded42f333a1192926",
  "canvas": {
    "width": 1448,
    "height": 1086
  },
  "states": {
    "visible": {
      "full_scene_variant": {
        "path": "res://resource/images/anomalies/room_107_hanging_girl/room_107_bed_nightstand/visible.webp",
        "sha256": "5c692f2c7ea49ddfa2f12fd313ea114b78d96051fe23b2c371ad52ff35381784",
        "width": 2896,
        "height": 2172
      }
    },
    "resolved": {
      "base_only": true
    }
  }
}
