{
  "schema_version": 1,
  "event_id": "room_107_human_skin_towel",
  "source_scene_id": "room_107_bathroom",
  "source_path": "res://resource/images/room_107_bathroom.png",
  "source_sha256": "668ddd1c70b50b78507bf3ceec9d2a4b25c50142df9c37e55399672d73b1c999",
  "canvas": {
    "width": 1448,
    "height": 1086
  },
  "states": {
    "visible": {
      "full_scene_variant": {
        "path": "res://resource/images/anomalies/room_107_human_skin_towel/room_107_bathroom/visible.webp",
        "sha256": "17a746c60fcfc568f1f5cfd0de02191de91798d8f6b6076e7a94a631de06306b",
        "width": 2896,
        "height": 2172
      }
    },
    "resolved": {
      "base_only": true
    }
  }
}
