{
  "schema_version": 1,
  "event_id": "front_die_sign",
  "source_scene_id": "front_desk",
  "source_path": "res://resource/images/front_desk.png",
  "source_sha256": "9fc6b06e7f7f9fa0fdf909ef569c7be6e8b36446db87e8202f838192179f9f60",
  "canvas": {
    "width": 1535,
    "height": 1024
  },
  "states": {
    "visible": {
      "full_scene_variant": {
        "path": "res://resource/images/anomalies/front_die_sign/front_desk/visible.webp",
        "sha256": "790035a7e661d9b4e01ad6f85929053ff63a535dfa961cd70c74cb93f52782bc",
        "width": 3070,
        "height": 2048
      }
    },
    "resolved": {
      "base_only": true
    }
  }
}
