{
  "schema_version": 1,
  "event_id": "room_109_open_door",
  "source_scene_id": "corridor",
  "source_path": "res://resource/images/corridor.png",
  "source_sha256": "a715b594a0abbf4502e2751d991f76d5331b44a9c57850cfad8898f0e459d867",
  "canvas": {
    "width": 1536,
    "height": 1024
  },
  "states": {
    "visible": {
      "full_scene_variant": {
        "path": "res://resource/images/anomalies/room_109_open_door/corridor/visible.webp",
        "sha256": "269c97dc3395086c77cf9e999b3e007ba9fe910355120fd4d743c9bb2692783a",
        "width": 3072,
        "height": 2048
      }
    },
    "resolved": {
      "base_only": true
    }
  }
}
