{
  "schema_version": 1,
  "event_id": "laundry_red_washer",
  "source_scene_id": "laundry_room",
  "source_path": "res://resource/images/laundry_room_washer_closed.png",
  "source_sha256": "4044c5dcb30e02efaeadce7b2a793b1a73cd3090c33e7cc90c5685c08641323d",
  "canvas": {
    "width": 1448,
    "height": 1086
  },
  "states": {
    "red": {
      "full_scene_variant": {
        "path": "res://resource/images/anomalies/laundry_red_washer/laundry_room/red.webp",
        "sha256": "e4d1f343862c6a50755d41ecc3403037269db3197a5de10c2ef432cb4bafb926",
        "width": 2896,
        "height": 2172
      }
    },
    "music": {
      "full_scene_variant": {
        "path": "res://resource/images/anomalies/laundry_red_washer/laundry_room/red.webp",
        "sha256": "e4d1f343862c6a50755d41ecc3403037269db3197a5de10c2ef432cb4bafb926",
        "width": 2896,
        "height": 2172
      }
    },
    "resolved": {
      "base_only": true
    }
  }
}
